[
  {
    "id": "sprite-frame-f31ede706e56",
    "character_id": "sprite-character-dinko",
    "animation_id": "sprite-animation-c3a229ebb1f4",
    "frame_index": 0,
    "image_path": "app-data/sprites/characters/dinko/dinko-technical-blink-pipeline/frame-0001-a51d8960.png",
    "width": 256,
    "height": 256,
    "duration_ms": 125,
    "anchor_x": 0.5,
    "anchor_y": 1.0,
    "offset_x": 0,
    "offset_y": 0,
    "opacity": 1,
    "approved": false,
    "validation_status": "valid",
    "validation_warnings": [],
    "review_status": "Not reviewed",
    "review_notes": "",
    "sha256": "a18ba11cfb0246d9c34cd3f63741c14e6a8b4d1d19bd815a224ee7589a2cf602",
    "transparent": true,
    "created_at": "2026-08-06T20:23:11.794477+00:00",
    "updated_at": "2026-08-06T20:23:11.794477+00:00"
  },
  {
    "id": "sprite-frame-fa1c81148875",
    "character_id": "sprite-character-dinko",
    "animation_id": "sprite-animation-c3a229ebb1f4",
    "frame_index": 1,
    "image_path": "app-data/sprites/characters/dinko/dinko-technical-blink-pipeline/frame-0002-ad6c0bb8.png",
    "width": 256,
    "height": 256,
    "duration_ms": 125,
    "anchor_x": 0.5,
    "anchor_y": 1.0,
    "offset_x": 0,
    "offset_y": 0,
    "opacity": 1,
    "approved": false,
    "validation_status": "valid",
    "validation_warnings": [],
    "review_status": "Not reviewed",
    "review_notes": "",
    "sha256": "6e771b651b437fde7c2f47691385fb3eb1b9b6b58ca046d780da16d63ed0b47f",
    "transparent": true,
    "created_at": "2026-08-06T20:23:11.888319+00:00",
    "updated_at": "2026-08-06T20:23:11.888319+00:00"
  },
  {
    "id": "sprite-frame-32aae28d0cf5",
    "character_id": "sprite-character-dinko",
    "animation_id": "sprite-animation-c3a229ebb1f4",
    "frame_index": 2,
    "image_path": "app-data/sprites/characters/dinko/dinko-technical-blink-pipeline/frame-0003-7066ee4b.png",
    "width": 256,
    "height": 256,
    "duration_ms": 125,
    "anchor_x": 0.5,
    "anchor_y": 1.0,
    "offset_x": 0,
    "offset_y": 0,
    "opacity": 1,
    "approved": false,
    "validation_status": "valid",
    "validation_warnings": [],
    "review_status": "Not reviewed",
    "review_notes": "",
    "sha256": "5ee9c29e4308b6c6ab73767316976377a82dd27934572eb089e63e91177a242c",
    "transparent": true,
    "created_at": "2026-08-06T20:23:11.987952+00:00",
    "updated_at": "2026-08-06T20:23:11.987952+00:00"
  },
  {
    "id": "sprite-frame-a311f9310620",
    "character_id": "sprite-character-dinko",
    "animation_id": "sprite-animation-43afd62527e1",
    "frame_index": 0,
    "image_path": "app-data/sprites/characters/dinko/dinko-technical-blink-pipeline-v2/frame-0001-9c96077a.png",
    "width": 256,
    "height": 256,
    "duration_ms": 125,
    "anchor_x": 0.5,
    "anchor_y": 1.0,
    "offset_x": 0,
    "offset_y": 0,
    "opacity": 1,
    "approved": false,
    "validation_status": "valid",
    "validation_warnings": [],
    "review_status": "Not reviewed",
    "review_notes": "",
    "sha256": "8fe21885653587f14e77ff806601bd630a376a1be86218b48a237700bc604d9a",
    "transparent": true,
    "created_at": "2026-08-06T20:26:23.175008+00:00",
    "updated_at": "2026-08-06T20:26:23.175008+00:00"
  },
  {
    "id": "sprite-frame-a010f05b7258",
    "character_id": "sprite-character-dinko",
    "animation_id": "sprite-animation-43afd62527e1",
    "frame_index": 1,
    "image_path": "app-data/sprites/characters/dinko/dinko-technical-blink-pipeline-v2/frame-0002-0c1f42de.png",
    "width": 256,
    "height": 256,
    "duration_ms": 125,
    "anchor_x": 0.5,
    "anchor_y": 1.0,
    "offset_x": 0,
    "offset_y": 0,
    "opacity": 1,
    "approved": false,
    "validation_status": "valid",
    "validation_warnings": [],
    "review_status": "Not reviewed",
    "review_notes": "",
    "sha256": "eb28937b4b8159839940e2d230bd037345e9e87d965b585ac25bc710d83d0884",
    "transparent": true,
    "created_at": "2026-08-06T20:26:23.283459+00:00",
    "updated_at": "2026-08-06T20:26:23.283459+00:00"
  },
  {
    "id": "sprite-frame-1e6b1cfd8e02",
    "character_id": "sprite-character-dinko",
    "animation_id": "sprite-animation-43afd62527e1",
    "frame_index": 2,
    "image_path": "app-data/sprites/characters/dinko/dinko-technical-blink-pipeline-v2/frame-0003-b19a68e1.png",
    "width": 256,
    "height": 256,
    "duration_ms": 125,
    "anchor_x": 0.5,
    "anchor_y": 1.0,
    "offset_x": 0,
    "offset_y": 0,
    "opacity": 1,
    "approved": false,
    "validation_status": "valid",
    "validation_warnings": [],
    "review_status": "Not reviewed",
    "review_notes": "",
    "sha256": "e5c33ab2a27e81243d67a9802ee251e4450ff747fa6a2d84dc85574c2cbe8cfc",
    "transparent": true,
    "created_at": "2026-08-06T20:26:23.382163+00:00",
    "updated_at": "2026-08-06T20:26:23.382163+00:00"
  }
]
